{
  "schemaVersion": "1.0.0",
  "providerId": "ceph",
  "targetId": "32684d2c-fca8-4f28-a946-fb267363fd6c",
  "resourceKind": "StorageBackend",
  "resourceUid": "backend-uid-a",
  "metrics": [
    { "kind": "capacity", "unit": "By", "value": 1099511627776, "status": "Known", "applicability": "Applicable", "source": "ceph_exporter", "observedAt": "2026-08-14T10:00:00Z", "freshness": "Fresh" },
    { "kind": "usage", "unit": "By", "value": 549755813888, "status": "Known", "applicability": "Applicable", "source": "ceph_exporter", "observedAt": "2026-08-14T10:00:00Z", "freshness": "Fresh" },
    { "kind": "iops", "unit": "1/s", "status": "NotReported", "applicability": "Unsupported", "source": "ceph_exporter", "observedAt": "2026-08-14T10:00:00Z", "freshness": "Fresh" },
    { "kind": "throughput", "unit": "By/s", "status": "NotReported", "applicability": "Applicable", "source": "ceph_exporter", "observedAt": "2026-08-14T10:00:00Z", "freshness": "Fresh" },
    { "kind": "latency", "unit": "s", "status": "Unknown", "applicability": "Unknown", "source": "ceph_exporter", "observedAt": "2026-08-14T10:00:00Z", "freshness": "Fresh" },
    { "kind": "health", "unit": "1", "value": 1, "status": "Known", "applicability": "Applicable", "source": "ceph_exporter", "observedAt": "2026-08-14T10:00:00Z", "freshness": "Fresh" }
  ]
}
